[
  {
    "title": "Privacybeleid",
    "url": "https://communicatie.vtm.be/privacy-policy",
    "source": "vtm",
    "scraped_at": "2026-02-12T14:09:25.872847Z",
    "date": "2026-02-12T05:00:00.000Z"
  },
  {
    "title": "Alle wegen in Bestemming X leiden naar… België: host Aster Nzeyimana verklapt spectaculaire plottwist aan de kijker ",
    "url": "https://communicatie.vtm.be/alle-wegen-in-bestemming-x-leiden-naar-belgie-host-aster-nzeyimana-verklapt-spectaculaire-plottwist-aan-de-kijker",
    "source": "vtm",
    "scraped_at": "2026-02-12T14:09:25.871708Z",
    "date": "2026-01-11T20:15:00.000Z"
  },
  {
    "title": "Voortaan áltijd een date op VTM GO+: Love Island het hele jaar door, nieuwe lokale versie dit najaar ",
    "url": "https://communicatie.vtm.be/voortaan-altijd-een-date-op-vtm-go-love-island-het-hele-jaar-door-nieuwe-lokale-versie-dit-najaar",
    "source": "vtm",
    "scraped_at": "2026-02-12T14:09:25.871593Z",
    "date": "2026-01-19T14:26:00.000Z"
  },
  {
    "title": "Birgit Van Mol presenteert straffe verhalen uit het buitenland in nieuw seizoen van Telefacts",
    "url": "https://communicatie.vtm.be/birgit-van-mol-presenteert-straffe-verhalen-uit-het-buitenland-in-nieuw-seizoen-van-telefacts",
    "source": "vtm",
    "scraped_at": "2026-02-12T14:09:25.871479Z",
    "date": "2026-01-26T12:26:00.000Z"
  },
  {
    "title": "Got Talent gaat over de landsgrenzen heen: VTM en RTL 4 bundelen de krachten voor de grootste talentenjacht van de Lage Landen",
    "url": "https://communicatie.vtm.be/got-talent-gaat-over-de-landsgrenzen-heen-vtm-en-rtl-4-bundelen-de-krachten-voor-de-grootste-talentenjacht-van-de-lage-landen",
    "source": "vtm",
    "scraped_at": "2026-02-12T14:09:25.871365Z",
    "date": "2026-02-04T15:30:00.000Z"
  },
  {
    "title": "Na emotionele BK-zege dit weekend: crossfenomeen Thibau Nys opent zijn hart in nieuwe docu",
    "url": "https://communicatie.vtm.be/na-emotionele-bk-zege-dit-weekend-crossfenomeen-thibau-nys-opent-zijn-hart-in-nieuwe-docu",
    "source": "vtm",
    "scraped_at": "2026-02-12T14:09:25.871240Z",
    "date": "2026-01-13T17:09:00.000Z"
  },
  {
    "title": "Koen Wauters en Wesley Sonck presenteren nieuwe reality gameshow De Box ",
    "url": "https://communicatie.vtm.be/koen-wauters-en-wesley-sonck-presenteren-nieuwe-reality-gameshow-de-box",
    "source": "vtm",
    "scraped_at": "2026-02-12T14:09:25.871082Z",
    "date": "2026-01-25T06:00:00.000Z"
  },
  {
    "title": "Nieuwe coaches. Nieuw decor. Nieuwe twists. Nieuwe energie. The Voice gaat harder dan ooit!",
    "url": "https://communicatie.vtm.be/nieuwe-coaches-nieuw-decor-nieuwe-twists-nieuwe-energie-the-voice-gaat-harder-dan-ooit",
    "source": "vtm",
    "scraped_at": "2026-02-12T14:09:25.870960Z",
    "date": "2026-01-27T06:00:00.000Z"
  },
  {
    "title": "Van dagschotels naar dementie: Danni ‘Pascalleke’ Heylen speelt tante Cleo in Florentina ",
    "url": "https://communicatie.vtm.be/van-dagschotels-naar-dementie-danni-pascalleke-heylen-speelt-tante-cleo-in-florentina",
    "source": "vtm",
    "scraped_at": "2026-02-12T14:09:25.870844Z",
    "date": "2026-02-09T08:00:00.000Z"
  },
  {
    "title": "Emotionele confrontatie voor Bart Appeltans in Een Echte Job: “Ik kreeg kippenvel toen ik haar naam zag staan”",
    "url": "https://communicatie.vtm.be/emotionele-confrontatie-voor-bart-appeltans-in-een-echte-job-ik-kreeg-kippenvel-toen-ik-haar-naam-zag-staan",
    "source": "vtm",
    "scraped_at": "2026-02-12T14:09:25.870729Z",
    "date": "2026-01-16T08:00:00.000Z"
  },
  {
    "title": "Intiem moment in jacuzzi zorgt voor concurrentiestrijd in Winter Vol Liefde",
    "url": "https://communicatie.vtm.be/intiem-moment-in-jacuzzi-zorgt-voor-concurrentiestrijd-in-winter-vol-liefde",
    "source": "vtm",
    "scraped_at": "2026-02-12T14:09:25.870610Z",
    "date": "2026-01-26T09:38:00.000Z"
  },
  {
    "title": "Host Laura Tesoro trapt opnames van vernieuwde So You Think You Can Dance af",
    "url": "https://communicatie.vtm.be/host-laura-tesoro-trapt-opnames-van-vernieuwde-so-you-think-you-can-dance-af",
    "source": "vtm",
    "scraped_at": "2026-02-12T14:09:25.870492Z",
    "date": "2026-01-29T05:00:00.000Z"
  },
  {
    "title": "Nieuwe afleveringen: ‘Moordzaken: Liefde is geen Alibi’ trekt de sluier weg van relationeel geweld",
    "url": "https://communicatie.vtm.be/nieuwe-afleveringen-moordzaken-liefde-is-geen-alibi-trekt-de-sluier-weg-van-relationeel-geweld",
    "source": "vtm",
    "scraped_at": "2026-02-12T14:09:25.870360Z",
    "date": "2026-02-09T09:00:00.000Z"
  },
  {
    "title": "“Vergelijk jij mij nu met een visboer?”: de strijd tussen de coaches barst meteen los in The Voice",
    "url": "https://communicatie.vtm.be/vergelijk-jij-mij-nu-met-een-visboer-de-strijd-tussen-de-coaches-barst-meteen-los-in-the-voice",
    "source": "vtm",
    "scraped_at": "2026-02-12T14:09:25.870217Z",
    "date": "2026-02-12T05:00:00.000Z",
    "content": {
      "paragraphs": [
        "Eerste Blind Auditions op vrijdag 13 februari om 20u40 bij VTM",
        "Meer dan 100 kandidaten staan voor één van de spannendste momenten uit hun leven. Vanaf morgen, vrijdag 13 februari, laten ze hun stem horen aan Vlaanderen én aan Joost Klein, Laura Tesoro, Koen Wauters en Mathieu Terryn. De lat ligt meteen hoog in The Voice van Vlaanderen, want bij een eerste ‘vierdraaier’ staan de coaches lijnrecht tegenover elkaar. Vooral Laura gaat voluit en dat ontgaat ooknewbieJoost niet. “Vergelijk jij mij nu met een visboer?”, reageert Laura wanneer hij haar vurige pleidooi vergelijkt met een verkooppraatje op de vismarkt. Wie haalt ‘de vis’ uiteindelijk binnen?",
        "Voor de strijd losbarst, trapt het nieuw-samengesteld coachkwartet het tiende jubileumseizoen van The Voice op gang met een knaller van een openingsnummer. Ze zingen (en rappen) samen een bijzondere versie van Ik Wil Je van De Kreuners.",
        "Bekijk het openingsnummer van de coaches hier:",
        "Een gouden stem en vier iconische draaistoelen. Daar draait het nadien allemaal om in de eerste Blind Auditions. Met een duwtje in de rug van host An Lemmens of Aster Nzeyimana betreden elf talenten het podium. Allemaal hopen ze op een plekje in team Joost, team Laura, team Koen of team Mathieu. Ondertussen gluren Q-dj’s Maarten & Dorothee mee in The Voice Comeback Stage, waar afgevallen talenten terugvechten voor een plek in de wedstrijd. De spin-off gaat vrijdag meteen na The Voice van start op VTM GO.",
        "Jean (Gent) werd geboren in Libanon en heeft Armeense roots. Zijn familie vluchtte naar België op zoek naar veiligheid en toekomstperspectief, nadat ze in Beiroet een verwoestende explosie meemaakten. ​​Jean zingt een Engels-Arabische versie van Desert Rose van Sting en Cheb Mami.",
        "Zingen is voor Aïcha (Deinze) geen hobby, maar een levensmissie. Een plan B heeft ze niet. Ze wil haar stem gebruiken om een goede boodschap de wereld in te sturen. ​​Aïcha zingt Chain of Fools van Aretha Franklin",
        "Ibe (Torhout) beleefde een moeilijke jeugd. Mentale gezondheid en depressie waren erg aanwezig in haar gezin. Ook persoonlijk klom Ibe recht na een zware periode. Met haar verhaal wil ze mensen bereiken, troost brengen en tonen dat er altijd hoop is.​Ibe zingt The Chain van Fleetwood Mac.",
        "Brecht (Zoutleeuw) is leraar lager onderwijs en zong ooit aan de zijde van o.a. Aaron Blommaert in de boyband Bobby. Nu is hij klaar om solo te gaan.​Brecht zingt een Nederlandstalige versie van Iris van Goo Goo Dolls",
        "Doris (Mechelen) is een doctoraatsstudente mondhygiëne met een passie voor songwriting. De liefde voor muziek kreeg ze van thuis mee. Tijdens haar auditie begeleidt ze zichzelf op de piano. ​​Doris zingt een akoestische versie van Dancing in the Dark van Bruce Springsteen",
        "Lukas’ (Stal) deelname aan The Voice staat in de sterren geschreven. Hij studeert namelijk astrofysica en is klaar om de sterren van de hemel te zingen.​Lukas zingt Warrior van Demi Lovato",
        "Kapster in spe Abigail (Geraardsbergen) schopte het in team Metejoor tot de knockouts van The Voice Kids. Sindsdien leerde ze heel wat bij en nu is Abigail klaar om te tonen hoeveel ze gegroeid is.​Abigail zingt Never Enough van Loren Allred",
        "Norah (Wintershoven) beleeft een jaar “van allemaal eerste keren”. De 18-jarige handbalkeeper beleeft haar eerste jaar als volwassene, zit in haar eerste jaar psychologie en neemt voor het eerst deel aan The Voice.​Norah zingt een akoestische versie van Girls Just Wanna Have Fun van Cyndi Lauper",
        "Ze is een vlotte babbelaar, heeft 5 Tik Tok-accounts en houdt van entertainen. Bovenal wil Nore (Vorselaar) mensen laten lachen. Haar deelname aan The Voice is “de grootste middelvinger naar de pestkoppen van vroeger”.​Nore zingt undressed van sombr",
        "Babs (Gent) staat bij haar vrienden bekend om haar ‘casual business woman’-stijl en sociale persoonlijkheid. Muziek is haar manier om mensen samen te brengen.​Babs zingt Dancing On My Own van Calum Scott",
        "Joke (Boom) beleefde een jeugd met veel obstakels. Ze werd zwaar gepest, maar haalde kracht uit haar muziek. Haar opa speelde een sleutelrol in haar muzikale parcours. “Hij is mijn superstar”, klinkt het.​Joke zingt Highway to Hell van AC/DC",
        "Met sterke stemmen, uitgesproken coaches en een competitie op het scherp van de snee wordt de tiende editie van The Voice een niet te missen afspraak op vrijdagavond. Of op eender welk ander moment. Zowel The Voice als The Voice Comeback Stage zijn namelijk telkens één week op voorhand in preview te bekijken met VTM GO+.",
        "Niet voor publicatie:",
        "De foto’s uit het persbericht kan je downloaden via communicatie.vtm.be.",
        "Bovenstaande video’s zijn over te nemen via deze embedcode:​<div style='padding-top: 56.25%; position: relative; height: 0; width: 100%;'><iframe allowfullscreen='' class='mc-embed' height='100%' mozallowfullscreen='' src='https://embed.mychannels.video/production/10798208?code=&external=true&loop=false&sticky=default&aspect_ratio=16%3A9&auto_play=default&auto_mute=default&single_play=false&pip=false'style='border: 0; position: absolute; left:0; top: 0; overflow:hidden;' webkitallowfullscreen='' width='100%'></iframe></div>"
      ],
      "full_text": "Eerste Blind Auditions op vrijdag 13 februari om 20u40 bij VTM Meer dan 100 kandidaten staan voor één van de spannendste momenten uit hun leven. Vanaf morgen, vrijdag 13 februari, laten ze hun stem horen aan Vlaanderen én aan Joost Klein, Laura Tesoro, Koen Wauters en Mathieu Terryn. De lat ligt meteen hoog in The Voice van Vlaanderen, want bij een eerste ‘vierdraaier’ staan de coaches lijnrecht tegenover elkaar. Vooral Laura gaat voluit en dat ontgaat ooknewbieJoost niet. “Vergelijk jij mij nu met een visboer?”, reageert Laura wanneer hij haar vurige pleidooi vergelijkt met een verkooppraatje op de vismarkt. Wie haalt ‘de vis’ uiteindelijk binnen? Voor de strijd losbarst, trapt het nieuw-samengesteld coachkwartet het tiende jubileumseizoen van The Voice op gang met een knaller van een openingsnummer. Ze zingen (en rappen) samen een bijzondere versie van Ik Wil Je van De Kreuners. Bekijk het openingsnummer van de coaches hier: Een gouden stem en vier iconische draaistoelen. Daar draait het nadien allemaal om in de eerste Blind Auditions. Met een duwtje in de rug van host An Lemmens of Aster Nzeyimana betreden elf talenten het podium. Allemaal hopen ze op een plekje in team Joost, team Laura, team Koen of team Mathieu. Ondertussen gluren Q-dj’s Maarten & Dorothee mee in The Voice Comeback Stage, waar afgevallen talenten terugvechten voor een plek in de wedstrijd. De spin-off gaat vrijdag meteen na The Voice van start op VTM GO. Jean (Gent) werd geboren in Libanon en heeft Armeense roots. Zijn familie vluchtte naar België op zoek naar veiligheid en toekomstperspectief, nadat ze in Beiroet een verwoestende explosie meemaakten. ​​Jean zingt een Engels-Arabische versie van Desert Rose van Sting en Cheb Mami. Zingen is voor Aïcha (Deinze) geen hobby, maar een levensmissie. Een plan B heeft ze niet. Ze wil haar stem gebruiken om een goede boodschap de wereld in te sturen. ​​Aïcha zingt Chain of Fools van Aretha Franklin Ibe (Torhout) beleefde een moeilijke jeugd. Mentale gezondheid en depressie waren erg aanwezig in haar gezin. Ook persoonlijk klom Ibe recht na een zware periode. Met haar verhaal wil ze mensen bereiken, troost brengen en tonen dat er altijd hoop is.​Ibe zingt The Chain van Fleetwood Mac. Brecht (Zoutleeuw) is leraar lager onderwijs en zong ooit aan de zijde van o.a. Aaron Blommaert in de boyband Bobby. Nu is hij klaar om solo te gaan.​Brecht zingt een Nederlandstalige versie van Iris van Goo Goo Dolls Doris (Mechelen) is een doctoraatsstudente mondhygiëne met een passie voor songwriting. De liefde voor muziek kreeg ze van thuis mee. Tijdens haar auditie begeleidt ze zichzelf op de piano. ​​Doris zingt een akoestische versie van Dancing in the Dark van Bruce Springsteen Lukas’ (Stal) deelname aan The Voice staat in de sterren geschreven. Hij studeert namelijk astrofysica en is klaar om de sterren van de hemel te zingen.​Lukas zingt Warrior van Demi Lovato Kapster in spe Abigail (Geraardsbergen) schopte het in team Metejoor tot de knockouts van The Voice Kids. Sindsdien leerde ze heel wat bij en nu is Abigail klaar om te tonen hoeveel ze gegroeid is.​Abigail zingt Never Enough van Loren Allred Norah (Wintershoven) beleeft een jaar “van allemaal eerste keren”. De 18-jarige handbalkeeper beleeft haar eerste jaar als volwassene, zit in haar eerste jaar psychologie en neemt voor het eerst deel aan The Voice.​Norah zingt een akoestische versie van Girls Just Wanna Have Fun van Cyndi Lauper Ze is een vlotte babbelaar, heeft 5 Tik Tok-accounts en houdt van entertainen. Bovenal wil Nore (Vorselaar) mensen laten lachen. Haar deelname aan The Voice is “de grootste middelvinger naar de pestkoppen van vroeger”.​Nore zingt undressed van sombr Babs (Gent) staat bij haar vrienden bekend om haar ‘casual business woman’-stijl en sociale persoonlijkheid. Muziek is haar manier om mensen samen te brengen.​Babs zingt Dancing On My Own van Calum Scott Joke (Boom) beleefde een jeugd met veel obstakels. Ze werd zwaar gepest, maar haalde kracht uit haar muziek. Haar opa speelde een sleutelrol in haar muzikale parcours. “Hij is mijn superstar”, klinkt het.​Joke zingt Highway to Hell van AC/DC Met sterke stemmen, uitgesproken coaches en een competitie op het scherp van de snee wordt de tiende editie van The Voice een niet te missen afspraak op vrijdagavond. Of op eender welk ander moment. Zowel The Voice als The Voice Comeback Stage zijn namelijk telkens één week op voorhand in preview te bekijken met VTM GO+. Niet voor publicatie: De foto’s uit het persbericht kan je downloaden via communicatie.vtm.be. Bovenstaande video’s zijn over te nemen via deze embedcode:​<div style='padding-top: 56.25%; position: relative; height: 0; width: 100%;'><iframe allowfullscreen='' class='mc-embed' height='100%' mozallowfullscreen='' src='https://embed.mychannels.video/production/10798208?code=&external=true&loop=false&sticky=default&aspect_ratio=16%3A9&auto_play=default&auto_mute=default&single_play=false&pip=false'style='border: 0; position: absolute; left:0; top: 0; overflow:hidden;' webkitallowfullscreen='' width='100%'></iframe></div>",
      "summary": "Eerste Blind Auditions op vrijdag 13 februari om 20u40 bij VTM",
      "published_date": "2026-02-12T05:00:00.000Z",
      "image_url": "https://cdn.uc.assets.prezly.com/42960a20-e9de-45c5-b0aa-7ea784932642/-/format/auto/PREZLY%20VTM.png",
      "meta_description": "Eerste Blind Auditions op vrijdag 13 februari om 20u40 bij VTM",
      "detected_programs": [
        "the voice",
        "thuis",
        "familie"
      ]
    }
  }
]